{
  "schema_version": "1.1.0",
  "profile_id": "opaque_prop_silver256",
  "status": "draft",
  "description": "Temporary Phase 6 density-review profile for the 256 px silver trim. The teal shell remains 1024 px.",
  "scope": {
    "asset_types": ["prop", "hard_surface", "environment_object"],
    "usage": ["distance", "close_up", "gameplay"],
    "first_target": "Gummy Bears / three.js",
    "notes": [
      "Crate is the initial technical benchmark.",
      "This profile evaluates the silver material at its actual 256 px resolution."
    ]
  },
  "requirements": {
    "units": "metres",
    "axes": "Blender +Z up; glTF conversion and destination orientation verified",
    "uv": "Active render UV required when image textures are used; intentionally untextured constant or procedural materials do not require a UV",
    "geometry": "Intended closed solids remain manifold; intentional open panels are declared",
    "source": "Editable Blender source preserved; destructive processing happens on an export copy"
  },
  "materials": {
    "model": "gltf_pbr_metallic_roughness",
    "required_channels": ["base_color", "roughness", "metallic", "normal"],
    "optional_channels": ["occlusion", "emissive"],
    "alpha": "opaque",
    "double_sided": false,
    "extensions": [],
    "notes": [
      "Procedural Blender graphs must be converted or baked for glTF.",
      "Do not bake lighting or reflections into base color."
    ]
  },
  "textures": {
    "source": "reusable albedo or baked source-to-export channels",
    "resolution_policy": "Measure 256 and 1024 as advisory variants; no mandatory asset-wide resolution",
    "color_spaces": {
      "base_color": "sRGB",
      "normal": "Non-Color",
      "roughness": "Non-Color",
      "metallic": "Non-Color",
      "occlusion": "Non-Color"
    },
    "tiling": "Verify tiling when a texture is intended to repeat"
  },
  "texel_density": {
    "method": "camera_projected_advisory",
    "camera": null,
    "viewport_px": [1920, 1080],
    "texture_resolutions_px": [[256, 256]],
    "target_texels_per_screen_pixel": [1.0, 2.0],
    "spread_ratio_max": 2.0,
    "anisotropy_ratio_max": 1.5,
    "zone_mode": "material",
    "small_triangle_screen_px": 4.0,
    "min_zone_samples": 4,
    "min_visible_fraction": 0.1,
    "advisory": true,
    "notes": [
      "Camera must be selected explicitly; the scene camera is never assumed to be the closest intended view.",
      "Ratios compare measured texture density with camera-projected screen density per triangle.",
      "This profile is for the 256 px silver trim only; teal remains 1024 px."
    ]
  },
  "web_delivery": {
    "format": "glb",
    "compression": {
      "ktx2": "optional_measured_variant",
      "meshopt": "optional_measured_variant",
      "draco": "optional_measured_variant"
    },
    "report": [
      "download_bytes",
      "estimated_gpu_memory",
      "material_count",
      "draw_call_count",
      "extensions"
    ],
    "required_extensions": [],
    "loader_changes": "Separate approval required"
  },
  "verification": {
    "structural": [
      "pinned_gltf_validator",
      "clean_import",
      "required_extensions",
      "correct_scale_axes_normals"
    ],
    "visual": [
      "near_far_captures",
      "material_channel_inspection",
      "seam_and_padding_inspection"
    ],
    "performance": [
      "headless_relative_only",
      "real_gpu_check"
    ],
    "evidence": [
      "glb_hash",
      "inventory",
      "captures",
      "validator_report",
      "provenance_record"
    ]
  },
  "limits": [
    "Temporary Phase 6 density-review profile; not a new production profile.",
    "No hard geometry or texture budget is established here.",
    "Texel-density thresholds are advisory and do not establish delivery acceptance.",
    "Validator conformance does not prove destination appearance."
  ],
  "deferred": [
    "Automatic material-zone segmentation",
    "Automatic routing rules",
    "Game registration"
  ]
}
